{
  "id": "intelligent-test-case-generation",
  "name": "Test Case Generation from Tickets",
  "version": "1.0.0",
  "description": "Use this to generate integration and end-to-end test cases from ticket requirements. Reads the ticket, traces affected code paths, identifies boundary conditions, and produces developer-readable test case descriptions.",
  "preconditions": [
    "User provides a ticket (title, description, acceptance criteria) in any standard format.",
    "Agent has read access to the codebase for tracing affected paths and finding existing test patterns.",
    "Agent can browse relevant documentation such as architecture docs or API specs if they exist."
  ],
  "metaGuidance": [
    "EXPLORE FIRST: use tools to read the ticket and codebase before asking the user anything. Only ask for information you genuinely cannot discover yourself.",
    "SCOPE: focus on integration and end-to-end tests. Unit tests are out of scope unless the ticket explicitly targets internal logic.",
    "BOUNDARY CONDITIONS: for each acceptance criterion, actively look for boundary values, empty/null cases, permission boundaries, and ordering dependencies.",
    "TRACEABILITY: every test scenario must map to at least one acceptance criterion or identified risk. Do not generate untraceable scenarios.",
    "DEVELOPER READABILITY: write test descriptions in plain language a developer can implement without guessing. Include what to set up, what to call, and what to assert.",
    "HONEST GAPS: if the ticket is ambiguous or the acceptance criteria are incomplete, name the specific gap and propose the most reasonable interpretation rather than silently guessing.",
    "V2 DURABILITY: use output.notesMarkdown as the primary durable record. Do not create TEST_CONTEXT.md or any markdown checkpoint file unless the user explicitly asks."
  ],
  "steps": [
    {
      "id": "phase-0-ticket-analysis",
      "title": "Phase 0: Read the Ticket and Understand the System",
      "prompt": "Read everything before you generate a single test case.\n\nStart with the ticket. Extract:\n- The core user action or system change being described\n- Every acceptance criterion (numbered list)\n- Explicit constraints and non-goals\n- Labels, priority, and any linked tickets that add context\n\nThen trace the affected code. Find:\n- Which modules, services, and API endpoints are touched\n- What data flows are involved (what goes in, what comes out, what persists)\n- Existing tests that cover adjacent behavior -- these show the expected test style and depth\n- Integration points that could break (external services, caches, auth, queues)\n\nFor each affected module, confirm you can state: what it does, what its entry points are, and what its integration boundaries are. If you cannot answer all three, keep tracing before moving on.\n\nThen classify the scope:\n- `ticketComplexity`: Simple / Standard / Complex\n  - Simple: single path, 1-3 clear acceptance criteria, low integration breadth\n  - Standard: multiple paths or criteria, moderate integration surface\n  - Complex: cross-service, high ambiguity, or significant edge case density\n- `testDepth`: Integration / E2E / Both\n\nFinally, check what you know:\n- Which acceptance criteria are clearly testable as stated?\n- Which are ambiguous or incomplete?\n- What integration boundaries are in scope?\n\nCapture:\n- `ticketSummary` -- one paragraph covering the core change and why it matters\n- `acceptanceCriteria` -- numbered list extracted from the ticket\n- `affectedPaths` -- key modules, endpoints, or services involved\n- `existingTestPatterns` -- test framework, naming style, and fixture approach used in this repo\n- `ticketComplexity`\n- `testDepth`\n- `ambiguities` -- acceptance criteria or requirements that are unclear or incomplete",
      "requireConfirmation": false
    },
    {
      "id": "phase-0b-clarify-ambiguities",
      "title": "Phase 0b: Resolve Critical Ambiguities",
      "runCondition": {
        "var": "ambiguities",
        "not_equals": []
      },
      "prompt": "Before generating test scenarios, resolve the ambiguities you found.\n\nFor each ambiguity in `ambiguities`:\n1. State what is unclear and why it matters for test design\n2. Propose the most reasonable interpretation based on context\n3. Ask me to confirm, adjust, or provide the missing information\n\nKeep questions targeted. If the ticket, codebase, or docs can answer the question, answer it yourself first.\n\nIf the user's response significantly changes the scope or adds new acceptance criteria, revisit Phase 1 scenario identification before continuing \u2014 do not carry stale scenarios forward.\n\nCapture:\n- `resolvedAmbiguities` -- list of ambiguities with chosen interpretation\n- `openAmbiguities` -- ambiguities the user still needs to resolve (initialize as empty)",
      "requireConfirmation": true
    },
    {
      "id": "phase-1-scenario-identification",
      "title": "Phase 1: Identify Test Scenarios",
      "prompt": "Turn the acceptance criteria and your system knowledge into a concrete list of test scenarios.\n\nFor each acceptance criterion, identify:\n\n**Happy path scenarios** (the criterion succeeds under normal conditions)\n- What is the minimal valid input that exercises this criterion?\n- Are there multiple valid input shapes that should each be tested?\n\n**Boundary and edge cases**\n- Empty, null, or missing inputs\n- Minimum and maximum values\n- Permission boundaries (authorized vs unauthorized)\n- Ordering dependencies (what must exist or happen first?)\n- Concurrent or retry scenarios if the feature involves state\n\n**Failure and degradation scenarios**\n- What happens when a dependency is unavailable or returns an error?\n- What happens when the input is invalid?\n- What happens when a required precondition is not met?\n\nFor each scenario, note:\n- Which acceptance criterion it covers\n- The risk if this case is not tested (Low / Medium / High)\n- Whether it is integration-level or E2E\n- `uncertain`: true if you are not confident the expected behavior is correct or if the implementation approach is unclear\n\nDo not write the test cases yet -- just the scenario list. For any scenario marked `uncertain: true`, add the specific question to `openAmbiguities` so it can be resolved before test cases are written.\n\nCapture:\n- `scenarios` -- list of identified test scenarios with criterion mapping and risk level",
      "requireConfirmation": false
    },
    {
      "id": "phase-2-coverage-check",
      "title": "Phase 2: Check Coverage Before Writing",
      "prompt": "Before writing test cases, verify that the scenario list is complete.\n\nFor each acceptance criterion, confirm:\n- At least one happy path scenario covers it\n- At least one boundary or failure scenario exists if the criterion involves state, permissions, or external calls\n- No criterion is left with zero scenarios\n\nAlso check:\n- Are there important integration points (auth, external services, persistence) with no coverage?\n- Are there critical paths in the code you traced that have no corresponding scenario?\n\nIf you find a gap, add the missing scenario to `scenarios` now. If a gap exists but you cannot fill it without more information, add it to `openAmbiguities`.\n\nReport:\n- Acceptance criteria coverage (which criteria have at least one scenario)\n- Integration boundary coverage (which boundaries are tested)\n- Any remaining gaps and why they exist\n\nCapture:\n- `scenarios` -- updated with any added scenarios\n- `coverageSummary` -- brief coverage assessment",
      "requireConfirmation": false
    },
    {
      "id": "phase-3-write-test-cases",
      "title": "Phase 3: Write the Test Cases",
      "prompt": "Write a test case description for each scenario in `scenarios`.\n\nEach test case must include:\n\n**ID**: TC-{N} where N is a sequential number\n**Title**: one clear sentence describing what is being verified\n**Acceptance Criterion**: which criterion from `acceptanceCriteria` this covers\n**Type**: Integration or E2E\n**Risk**: Low / Medium / High (from your scenario analysis)\n**Preconditions**: what must be set up or exist before the test runs\n**Test Steps**: numbered list of actions in plain language\n**Expected Result**: what the system should do or return\n**Notes**: any implementation hints, known edge cases, or open questions\n\nWrite test cases in the style found in `existingTestPatterns`. If no patterns were found, use this plain Markdown structure for each test case: **Given** (preconditions and setup), **When** (the action taken), **Then** (expected result and assertions).\n\nGroup test cases by acceptance criterion.\n\nAfter writing all test cases, produce a summary table with:\n- TC-{N} | Title | Type | Risk | Criterion\n\nCapture:\n- `testCaseCount` -- total number of test cases written",
      "requireConfirmation": false
    },
    {
      "id": "phase-4-review-and-handoff",
      "title": "Phase 4: Review and Handoff",
      "prompt": "Before handing off, do a final review pass.\n\nCheck each test case for:\n- Completeness: are preconditions, steps, and expected results clear enough to implement without guessing?\n- Accuracy: does the expected result match what the system should actually do?\n- Traceability: does every test case map to a criterion or identified risk?\n- Redundancy: are there duplicates that could be merged?\n\nThen summarize what was produced:\n- How many test cases, broken down by type (Integration / E2E) and risk level (High / Medium / Low)\n- Which acceptance criteria have full coverage (happy path + at least one negative case)\n- Which criteria have partial coverage and why\n- Any open questions the implementer should resolve before writing the tests\n- Anything this workflow could not determine from the ticket or codebase\n\nPresent the full test case list, then the summary.",
      "requireConfirmation": true
    }
  ]
}
